{
  "schema": "prism/policy-input/1",
  "holo": {
    "fingerprint": "blake3:8408e0895572fab09e783f7aadb129dc4cb96d0b62850a16f3ddbe44ed6021ba",
    "revision": "2026-10-23",
    "digests": {
      "archive": {
        "sha256": "84371aaac82af6b2a81a25a81d43d4097892985f55ae4919cfdcfa8b6e3486e7",
        "blake3": "4efe02106778d44a469cc0fc8f6998167af7c9075a3ac605c150098c0f5243bb"
      },
      "capabilities": {
        "sha256": "888ef9fab26cf92f0a20a1d0fdf7e5dd494f7eb7ec23dfb26a039a7233cb4a02",
        "blake3": "cf46eb3028b50fde0444a1a648f5ce7cba94013f541c86537df54adf5d203e1c"
      },
      "guest": {
        "sha256": "dcf53677c7c80636f8fc2247676b8f747d1549ce4af742c8505eb0f0ae334c03",
        "blake3": "2adca3e7ca42d7415a5227a20002baad90047d087249cbb9ea36e557f5a4a380"
      },
      "view": {
        "sha256": "c232ee20ca0115cd9c53b17687dde96292028700e6b626319960331ec6591906",
        "blake3": "9860e7054e3f3a8e6ab79c26bcda06bc65778ebdda211160ea66871142b7c808"
      },
      "model": {
        "sha256": "074921890f5c372c89f4ed794d26dd550231d5e9bf99bf9474cc1a78923292c6",
        "blake3": "e76544838a98c46341ed8807f72897ec68de5a8a9bf28721738a76761c9df90e"
      }
    }
  },
  "verdict": {
    "level": "P0",
    "reasons": [
      {
        "check": "provenance.statement",
        "withholds": "P1",
        "message": "The holo carries no provenance statement; format revision 2026-10-23 has no attestation bundle (issues #267 and #268)."
      },
      {
        "check": "proof.statement",
        "withholds": "P2",
        "message": "The holo carries no proof statement (issue #266)."
      },
      {
        "check": "replay.statement",
        "withholds": "P3",
        "message": "The holo carries no replay statement (issue #284)."
      }
    ]
  },
  "world": {
    "contract": "hologram:guest/core-wasm@1",
    "known": true,
    "within": true,
    "pure": true,
    "effects": [],
    "imports": [],
    "problems": [],
    "capability_set": {
      "label": "blake3:cf46eb3028b50fde0444a1a648f5ce7cba94013f541c86537df54adf5d203e1c",
      "empty": true
    }
  },
  "capabilities": {
    "allow-variables": [
      "API_KEY"
    ]
  },
  "predicates": {
    "provenance": null,
    "proof": null,
    "replay": null
  }
}
